"No.","Time","Source","Destination","Protocol","Length","Info"
"1","0.000000000","127.0.0.1","127.0.0.1","TCP","74","14000  >  12000 [SYN] Seq=0 Win=65495 Len=0 MSS=65495 SACK_PERM=1 TSval=128089508 TSecr=0 WS=128"
"2","0.000011654","127.0.0.1","127.0.0.1","TCP","66","12000  >  14000 [ACK] Seq=3897200914 Ack=3897332400 Win=65536 Len=0 TSval=128089508 TSecr=128069646"
"3","0.000033288","127.0.0.1","127.0.0.1","TCP","54","14000  >  12000 [RST] Seq=3897332400 Win=0 Len=0"
"4","0.000052840","127.0.0.1","127.0.0.1","TCP","74","14001  >  12001 [SYN] Seq=0 Win=65495 Len=0 MSS=65495 SACK_PERM=1 TSval=128089508 TSecr=0 WS=128"
"5","0.000057882","127.0.0.1","127.0.0.1","TCP","66","12001  >  14001 [ACK] Seq=3897199916 Ack=3897331473 Win=65536 Len=0 TSval=128089508 TSecr=128069646"
"6","0.000061149","127.0.0.1","127.0.0.1","TCP","54","14001  >  12001 [RST] Seq=3897331473 Win=0 Len=0"
"7","0.000117900","127.0.0.1","127.0.0.1","TCP","74","14002  >  12002 [SYN] Seq=0 Win=65495 Len=0 MSS=65495 SACK_PERM=1 TSval=128089508 TSecr=0 WS=128"
"8","0.000119997","127.0.0.1","127.0.0.1","TCP","66","12002  >  14002 [ACK] Seq=3897199961 Ack=3897330478 Win=65536 Len=0 TSval=128089508 TSecr=128069646"
"9","0.000121918","127.0.0.1","127.0.0.1","TCP","54","14002  >  12002 [RST] Seq=3897330478 Win=0 Len=0"
"10","0.000295007","127.0.0.1","127.0.0.1","TCP","74","14003  >  12003 [SYN] Seq=0 Win=65495 Len=0 MSS=65495 SACK_PERM=1 TSval=128089508 TSecr=0 WS=128"
"11","0.000296579","127.0.0.1","127.0.0.1","TCP","66","12003  >  14003 [ACK] Seq=3897333490 Ack=3897326857 Win=65536 Len=0 TSval=128089508 TSecr=128069646"
"12","0.000298357","127.0.0.1","127.0.0.1","TCP","54","14003  >  12003 [RST] Seq=3897326857 Win=0 Len=0"
"13","0.000307549","127.0.0.1","127.0.0.1","TCP","74","14004  >  12004 [SYN] Seq=0 Win=65495 Len=0 MSS=65495 SACK_PERM=1 TSval=128089508 TSecr=0 WS=128"
"14","0.000310872","127.0.0.1","127.0.0.1","TCP","66","12004  >  14004 [ACK] Seq=3897396386 Ack=3897329768 Win=65536 Len=0 TSval=128089508 TSecr=128069646"
"15","0.000313597","127.0.0.1","127.0.0.1","TCP","54","14004  >  12004 [RST] Seq=3897329768 Win=0 Len=0"
"16","0.010366641","127.0.0.1","127.0.0.1","TCP","74","[TCP Retransmission] [TCP Port numbers reused] 14004  >  12004 [SYN] Seq=0 Win=65495 Len=0 MSS=65495 SACK_PERM=1 TSval=128089518 TSecr=0 WS=128"
"17","0.010400164","127.0.0.1","127.0.0.1","TCP","74","[TCP Previous segment not captured] [TCP Port numbers reused] 12004  >  14004 [SYN, ACK] Seq=0 Ack=1 Win=65483 Len=0 MSS=65495 SACK_PERM=1 TSval=128089518 TSecr=128089518 WS=128"
"18","0.010408544","127.0.0.1","127.0.0.1","TCP","66","[TCP ACKed unseen segment] 14004  >  12004 [ACK] Seq=1 Ack=1 Win=65536 Len=0 TSval=128089518 TSecr=128089518"
"19","0.010491926","127.0.0.1","127.0.0.1","TCP","115","12004  >  14004 [PSH, ACK] Seq=1 Ack=1 Win=65536 Len=49 TSval=128089518 TSecr=128089518"
"20","0.010495236","127.0.0.1","127.0.0.1","TCP","66","14004  >  12004 [ACK] Seq=1 Ack=50 Win=65536 Len=0 TSval=128089518 TSecr=128089518"
"21","0.014434182","127.0.0.1","127.0.0.1","TCP","74","[TCP Retransmission] [TCP Port numbers reused] 14000  >  12000 [SYN] Seq=0 Win=65495 Len=0 MSS=65495 SACK_PERM=1 TSval=128089522 TSecr=0 WS=128"
"22","0.014439580","127.0.0.1","127.0.0.1","TCP","74","[TCP Retransmission] [TCP Port numbers reused] 14003  >  12003 [SYN] Seq=0 Win=65495 Len=0 MSS=65495 SACK_PERM=1 TSval=128089522 TSecr=0 WS=128"
"23","0.014452150","127.0.0.1","127.0.0.1","TCP","74","[TCP Previous segment not captured] [TCP Port numbers reused] 12000  >  14000 [SYN, ACK] Seq=0 Ack=1 Win=65483 Len=0 MSS=65495 SACK_PERM=1 TSval=128089522 TSecr=128089522 WS=128"
"24","0.014442441","127.0.0.1","127.0.0.1","TCP","74","[TCP Retransmission] [TCP Port numbers reused] 14002  >  12002 [SYN] Seq=0 Win=65495 Len=0 MSS=65495 SACK_PERM=1 TSval=128089522 TSecr=0 WS=128"
"25","0.014459777","127.0.0.1","127.0.0.1","TCP","66","[TCP ACKed unseen segment] 14000  >  12000 [ACK] Seq=1 Ack=1 Win=65536 Len=0 TSval=128089522 TSecr=128089522"
"26","0.014444522","127.0.0.1","127.0.0.1","TCP","74","[TCP Retransmission] [TCP Port numbers reused] 14001  >  12001 [SYN] Seq=0 Win=65495 Len=0 MSS=65495 SACK_PERM=1 TSval=128089522 TSecr=0 WS=128"
"27","0.014457904","127.0.0.1","127.0.0.1","TCP","74","[TCP Previous segment not captured] [TCP Port numbers reused] 12003  >  14003 [SYN, ACK] Seq=0 Ack=1 Win=65483 Len=0 MSS=65495 SACK_PERM=1 TSval=128089522 TSecr=128089522 WS=128"
"28","0.014461136","127.0.0.1","127.0.0.1","TCP","74","[TCP Previous segment not captured] [TCP Port numbers reused] 12002  >  14002 [SYN, ACK] Seq=0 Ack=1 Win=65483 Len=0 MSS=65495 SACK_PERM=1 TSval=128089522 TSecr=128089522 WS=128"
"29","0.014463989","127.0.0.1","127.0.0.1","TCP","74","[TCP Previous segment not captured] [TCP Port numbers reused] 12001  >  14001 [SYN, ACK] Seq=0 Ack=1 Win=65483 Len=0 MSS=65495 SACK_PERM=1 TSval=128089522 TSecr=128089522 WS=128"
"30","0.014473509","127.0.0.1","127.0.0.1","TCP","66","[TCP ACKed unseen segment] 14003  >  12003 [ACK] Seq=1 Ack=1 Win=65536 Len=0 TSval=128089522 TSecr=128089522"
"31","0.014478474","127.0.0.1","127.0.0.1","TCP","66","[TCP ACKed unseen segment] 14002  >  12002 [ACK] Seq=1 Ack=1 Win=65536 Len=0 TSval=128089522 TSecr=128089522"
"32","0.014482723","127.0.0.1","127.0.0.1","TCP","66","[TCP ACKed unseen segment] 14001  >  12001 [ACK] Seq=1 Ack=1 Win=65536 Len=0 TSval=128089522 TSecr=128089522"
"33","0.014509325","127.0.0.1","127.0.0.1","TCP","113","12000  >  14000 [PSH, ACK] Seq=1 Ack=1 Win=65536 Len=47 TSval=128089522 TSecr=128089522"
"34","0.014515292","127.0.0.1","127.0.0.1","TCP","66","14000  >  12000 [ACK] Seq=1 Ack=48 Win=65536 Len=0 TSval=128089522 TSecr=128089522"
"35","0.014545409","127.0.0.1","127.0.0.1","TCP","114","12001  >  14001 [PSH, ACK] Seq=1 Ack=1 Win=65536 Len=48 TSval=128089522 TSecr=128089522 [TCP segment of a reassembled PDU]"
"36","0.014549205","127.0.0.1","127.0.0.1","TCP","66","14001  >  12001 [ACK] Seq=1 Ack=49 Win=65536 Len=0 TSval=128089522 TSecr=128089522"
"37","0.014575453","127.0.0.1","127.0.0.1","TCP","114","12003  >  14003 [PSH, ACK] Seq=1 Ack=1 Win=65536 Len=48 TSval=128089522 TSecr=128089522"
"38","0.014579946","127.0.0.1","127.0.0.1","TCP","66","14003  >  12003 [ACK] Seq=1 Ack=49 Win=65536 Len=0 TSval=128089522 TSecr=128089522"
"39","0.014737397","127.0.0.1","127.0.0.1","TCP","114","12002  >  14002 [PSH, ACK] Seq=1 Ack=1 Win=65536 Len=48 TSval=128089523 TSecr=128089522"
"40","0.014741152","127.0.0.1","127.0.0.1","TCP","66","14002  >  12002 [ACK] Seq=1 Ack=49 Win=65536 Len=0 TSval=128089523 TSecr=128089523"
"41","0.511099249","127.0.0.1","127.0.0.1","TCP","1090","12004  >  14004 [PSH, ACK] Seq=50 Ack=1 Win=65536 Len=1024 TSval=128090019 TSecr=128089518"
"42","0.511110580","127.0.0.1","127.0.0.1","TCP","66","14004  >  12004 [ACK] Seq=1 Ack=1074 Win=64512 Len=0 TSval=128090019 TSecr=128090019"
"43","0.511131186","127.0.0.1","127.0.0.1","TCP","1090","12004  >  14004 [PSH, ACK] Seq=1074 Ack=1 Win=65536 Len=1024 TSval=128090019 TSecr=128090019"
"44","0.511135973","127.0.0.1","127.0.0.1","TCP","66","14004  >  12004 [ACK] Seq=1 Ack=2098 Win=63872 Len=0 TSval=128090019 TSecr=128090019"
"45","0.511144463","127.0.0.1","127.0.0.1","TCP","1090","12004  >  14004 [PSH, ACK] Seq=2098 Ack=1 Win=65536 Len=1024 TSval=128090019 TSecr=128090019"
"46","0.511146937","127.0.0.1","127.0.0.1","TCP","66","14004  >  12004 [ACK] Seq=1 Ack=3122 Win=63360 Len=0 TSval=128090019 TSecr=128090019"
"47","0.511154686","127.0.0.1","127.0.0.1","TCP","1090","12004  >  14004 [PSH, ACK] Seq=3122 Ack=1 Win=65536 Len=1024 TSval=128090019 TSecr=128090019"
"48","0.511156999","127.0.0.1","127.0.0.1","TCP","66","14004  >  12004 [ACK] Seq=1 Ack=4146 Win=62848 Len=0 TSval=128090019 TSecr=128090019"
"49","0.511164032","127.0.0.1","127.0.0.1","TCP","1090","12004  >  14004 [PSH, ACK] Seq=4146 Ack=1 Win=65536 Len=1024 TSval=128090019 TSecr=128090019"
"50","0.511166394","127.0.0.1","127.0.0.1","TCP","66","14004  >  12004 [ACK] Seq=1 Ack=5170 Win=62336 Len=0 TSval=128090019 TSecr=128090019"
"51","0.511173547","127.0.0.1","127.0.0.1","TCP","1090","12004  >  14004 [PSH, ACK] Seq=5170 Ack=1 Win=65536 Len=1024 TSval=128090019 TSecr=128090019"
"52","0.511176572","127.0.0.1","127.0.0.1","TCP","66","14004  >  12004 [ACK] Seq=1 Ack=6194 Win=61824 Len=0 TSval=128090019 TSecr=128090019"
"53","0.511183848","127.0.0.1","127.0.0.1","TCP","1090","12004  >  14004 [PSH, ACK] Seq=6194 Ack=1 Win=65536 Len=1024 TSval=128090019 TSecr=128090019"
"54","0.511186218","127.0.0.1","127.0.0.1","TCP","66","14004  >  12004 [ACK] Seq=1 Ack=7218 Win=61312 Len=0 TSval=128090019 TSecr=128090019"
"55","0.511193509","127.0.0.1","127.0.0.1","TCP","1090","12004  >  14004 [PSH, ACK] Seq=7218 Ack=1 Win=65536 Len=1024 TSval=128090019 TSecr=128090019"
"56","0.511196512","127.0.0.1","127.0.0.1","TCP","66","14004  >  12004 [ACK] Seq=1 Ack=8242 Win=60800 Len=0 TSval=128090019 TSecr=128090019"
"57","0.511203536","127.0.0.1","127.0.0.1","TCP","1090","12004  >  14004 [PSH, ACK] Seq=8242 Ack=1 Win=65536 Len=1024 TSval=128090019 TSecr=128090019"
"58","0.511205847","127.0.0.1","127.0.0.1","TCP","66","14004  >  12004 [ACK] Seq=1 Ack=9266 Win=60288 Len=0 TSval=128090019 TSecr=128090019"
"59","0.511212833","127.0.0.1","127.0.0.1","TCP","1090","12004  >  14004 [PSH, ACK] Seq=9266 Ack=1 Win=65536 Len=1024 TSval=128090019 TSecr=128090019"
"60","0.511215634","127.0.0.1","127.0.0.1","TCP","66","14004  >  12004 [ACK] Seq=1 Ack=10290 Win=59776 Len=0 TSval=128090019 TSecr=128090019"
"61","0.511222635","127.0.0.1","127.0.0.1","TCP","1090","12004  >  14004 [PSH, ACK] Seq=10290 Ack=1 Win=65536 Len=1024 TSval=128090019 TSecr=128090019"
"62","0.511224999","127.0.0.1","127.0.0.1","TCP","66","14004  >  12004 [ACK] Seq=1 Ack=11314 Win=59264 Len=0 TSval=128090019 TSecr=128090019"
"63","0.511231921","127.0.0.1","127.0.0.1","TCP","1090","12004  >  14004 [PSH, ACK] Seq=11314 Ack=1 Win=65536 Len=1024 TSval=128090019 TSecr=128090019"
"64","0.511234220","127.0.0.1","127.0.0.1","TCP","66","14004  >  12004 [ACK] Seq=1 Ack=12338 Win=58752 Len=0 TSval=128090019 TSecr=128090019"
"65","0.511241235","127.0.0.1","127.0.0.1","TCP","1090","12004  >  14004 [PSH, ACK] Seq=12338 Ack=1 Win=65536 Len=1024 TSval=128090019 TSecr=128090019"
"66","0.511244366","127.0.0.1","127.0.0.1","TCP","66","14004  >  12004 [ACK] Seq=1 Ack=13362 Win=58240 Len=0 TSval=128090019 TSecr=128090019"
"67","0.511251324","127.0.0.1","127.0.0.1","TCP","1090","12004  >  14004 [PSH, ACK] Seq=13362 Ack=1 Win=65536 Len=1024 TSval=128090019 TSecr=128090019"
"68","0.511254689","127.0.0.1","127.0.0.1","TCP","66","14004  >  12004 [ACK] Seq=1 Ack=14386 Win=57728 Len=0 TSval=128090019 TSecr=128090019"
"69","0.511261609","127.0.0.1","127.0.0.1","TCP","1090","12004  >  14004 [PSH, ACK] Seq=14386 Ack=1 Win=65536 Len=1024 TSval=128090019 TSecr=128090019"
"70","0.511280866","127.0.0.1","127.0.0.1","TCP","66","14004  >  12004 [ACK] Seq=1 Ack=15410 Win=56704 Len=0 TSval=128090019 TSecr=128090019"
"71","0.511298536","127.0.0.1","127.0.0.1","TCP","8394","12004  >  14004 [PSH, ACK] Seq=15410 Ack=1 Win=65536 Len=8328 TSval=128090019 TSecr=128090019"
"72","0.511311541","127.0.0.1","127.0.0.1","TCP","66","14004  >  12004 [ACK] Seq=1 Ack=23738 Win=48384 Len=0 TSval=128090019 TSecr=128090019"
"73","0.515199829","127.0.0.1","127.0.0.1","TCP","1090","12003  >  14003 [PSH, ACK] Seq=49 Ack=1 Win=65536 Len=1024 TSval=128090023 TSecr=128089522"
"74","0.515211313","127.0.0.1","127.0.0.1","TCP","66","14003  >  12003 [ACK] Seq=1 Ack=1073 Win=64512 Len=0 TSval=128090023 TSecr=128090023"
"75","0.515238603","127.0.0.1","127.0.0.1","TCP","1090","12003  >  14003 [PSH, ACK] Seq=1073 Ack=1 Win=65536 Len=1024 TSval=128090023 TSecr=128090023"
"76","0.515243569","127.0.0.1","127.0.0.1","TCP","66","14003  >  12003 [ACK] Seq=1 Ack=2097 Win=63872 Len=0 TSval=128090023 TSecr=128090023"
"77","0.515254715","127.0.0.1","127.0.0.1","TCP","1090","12003  >  14003 [PSH, ACK] Seq=2097 Ack=1 Win=65536 Len=1024 TSval=128090023 TSecr=128090023"
"78","0.515259137","127.0.0.1","127.0.0.1","TCP","66","14003  >  12003 [ACK] Seq=1 Ack=3121 Win=63360 Len=0 TSval=128090023 TSecr=128090023"
"79","0.515269981","127.0.0.1","127.0.0.1","TCP","1090","12003  >  14003 [PSH, ACK] Seq=3121 Ack=1 Win=65536 Len=1024 TSval=128090023 TSecr=128090023"
"80","0.515273541","127.0.0.1","127.0.0.1","TCP","66","14003  >  12003 [ACK] Seq=1 Ack=4145 Win=62848 Len=0 TSval=128090023 TSecr=128090023"
"81","0.515303054","127.0.0.1","127.0.0.1","TCP","1090","12002  >  14002 [PSH, ACK] Seq=49 Ack=1 Win=65536 Len=1024 TSval=128090023 TSecr=128089523"
"82","0.515306731","127.0.0.1","127.0.0.1","TCP","1090","12003  >  14003 [PSH, ACK] Seq=4145 Ack=1 Win=65536 Len=1024 TSval=128090023 TSecr=128090023"
"83","0.515311479","127.0.0.1","127.0.0.1","TCP","66","14003  >  12003 [ACK] Seq=1 Ack=5169 Win=62336 Len=0 TSval=128090023 TSecr=128090023"
"84","0.515309676","127.0.0.1","127.0.0.1","TCP","66","14002  >  12002 [ACK] Seq=1 Ack=1073 Win=64512 Len=0 TSval=128090023 TSecr=128090023"
"85","0.515322577","127.0.0.1","127.0.0.1","TCP","1090","12003  >  14003 [PSH, ACK] Seq=5169 Ack=1 Win=65536 Len=1024 TSval=128090023 TSecr=128090023"
"86","0.515326944","127.0.0.1","127.0.0.1","TCP","66","14003  >  12003 [ACK] Seq=1 Ack=6193 Win=64384 Len=0 TSval=128090023 TSecr=128090023"
"87","0.515330413","127.0.0.1","127.0.0.1","TCP","1090","12002  >  14002 [PSH, ACK] Seq=1073 Ack=1 Win=65536 Len=1024 TSval=128090023 TSecr=128090023"
"88","0.515336125","127.0.0.1","127.0.0.1","TCP","66","14002  >  12002 [ACK] Seq=1 Ack=2097 Win=63872 Len=0 TSval=128090023 TSecr=128090023"
"89","0.515339026","127.0.0.1","127.0.0.1","TCP","1090","12003  >  14003 [PSH, ACK] Seq=6193 Ack=1 Win=65536 Len=1024 TSval=128090023 TSecr=128090023"
"90","0.515347464","127.0.0.1","127.0.0.1","TCP","1090","12002  >  14002 [PSH, ACK] Seq=2097 Ack=1 Win=65536 Len=1024 TSval=128090023 TSecr=128090023"
"91","0.515343280","127.0.0.1","127.0.0.1","TCP","66","14003  >  12003 [ACK] Seq=1 Ack=7217 Win=64384 Len=0 TSval=128090023 TSecr=128090023"
"92","0.515351926","127.0.0.1","127.0.0.1","TCP","66","14002  >  12002 [ACK] Seq=1 Ack=3121 Win=63360 Len=0 TSval=128090023 TSecr=128090023"
"93","0.515404770","127.0.0.1","127.0.0.1","TCP","1090","12001  >  14001 [PSH, ACK] Seq=49 Ack=1 Win=65536 Len=1024 TSval=128090023 TSecr=128089522 [TCP segment of a reassembled PDU]"
"94","0.515415817","127.0.0.1","127.0.0.1","TCP","1090","12003  >  14003 [PSH, ACK] Seq=7217 Ack=1 Win=65536 Len=1024 TSval=128090023 TSecr=128090023"
"95","0.515419801","127.0.0.1","127.0.0.1","TCP","1090","12002  >  14002 [PSH, ACK] Seq=3121 Ack=1 Win=65536 Len=1024 TSval=128090023 TSecr=128090023"
"96","0.515416108","127.0.0.1","127.0.0.1","TCP","66","14001  >  12001 [ACK] Seq=1 Ack=1073 Win=64512 Len=0 TSval=128090023 TSecr=128090023"
"97","0.515424113","127.0.0.1","127.0.0.1","TCP","66","14002  >  12002 [ACK] Seq=1 Ack=4145 Win=64384 Len=0 TSval=128090023 TSecr=128090023"
"98","0.515423071","127.0.0.1","127.0.0.1","TCP","66","14003  >  12003 [ACK] Seq=1 Ack=8241 Win=64384 Len=0 TSval=128090023 TSecr=128090023"
"99","0.515582598","127.0.0.1","127.0.0.1","TCP","1090","12003  >  14003 [PSH, ACK] Seq=8241 Ack=1 Win=65536 Len=1024 TSval=128090023 TSecr=128090023"
"100","0.515592588","127.0.0.1","127.0.0.1","TCP","66","14003  >  12003 [ACK] Seq=1 Ack=9265 Win=64384 Len=0 TSval=128090023 TSecr=128090023"
"101","0.515598481","127.0.0.1","127.0.0.1","TCP","1090","12002  >  14002 [PSH, ACK] Seq=4145 Ack=1 Win=65536 Len=1024 TSval=128090023 TSecr=128090023"
"102","0.515604766","127.0.0.1","127.0.0.1","TCP","66","14002  >  12002 [ACK] Seq=1 Ack=5169 Win=64384 Len=0 TSval=128090023 TSecr=128090023"
"103","0.515622351","127.0.0.1","127.0.0.1","TCP","1090","12003  >  14003 [PSH, ACK] Seq=9265 Ack=1 Win=65536 Len=1024 TSval=128090023 TSecr=128090023"
"104","0.515625656","127.0.0.1","127.0.0.1","TCP","1090","12002  >  14002 [PSH, ACK] Seq=5169 Ack=1 Win=65536 Len=1024 TSval=128090023 TSecr=128090023"
"105","0.515627369","127.0.0.1","127.0.0.1","TCP","66","14003  >  12003 [ACK] Seq=1 Ack=10289 Win=63872 Len=0 TSval=128090023 TSecr=128090023"
"106","0.515630551","127.0.0.1","127.0.0.1","TCP","66","14002  >  12002 [ACK] Seq=1 Ack=6193 Win=63872 Len=0 TSval=128090023 TSecr=128090023"
"107","0.515675875","127.0.0.1","127.0.0.1","TCP","1090","12001  >  14001 [PSH, ACK] Seq=1073 Ack=1 Win=65536 Len=1024 TSval=128090023 TSecr=128090023 [TCP segment of a reassembled PDU]"
"108","0.515686431","127.0.0.1","127.0.0.1","TCP","66","14001  >  12001 [ACK] Seq=1 Ack=2097 Win=64384 Len=0 TSval=128090023 TSecr=128090023"
"109","0.515698279","127.0.0.1","127.0.0.1","TCP","1090","12000  >  14000 [PSH, ACK] Seq=48 Ack=1 Win=65536 Len=1024 TSval=128090024 TSecr=128089522"
"110","0.515699637","127.0.0.1","127.0.0.1","TCP","1090","12002  >  14002 [PSH, ACK] Seq=6193 Ack=1 Win=65536 Len=1024 TSval=128090024 TSecr=128090023"
"111","0.515704140","127.0.0.1","127.0.0.1","TCP","1090","12003  >  14003 [PSH, ACK] Seq=10289 Ack=1 Win=65536 Len=1024 TSval=128090024 TSecr=128090023"
"112","0.515709254","127.0.0.1","127.0.0.1","TCP","1090","12001  >  14001 [PSH, ACK] Seq=2097 Ack=1 Win=65536 Len=1024 TSval=128090024 TSecr=128090023 [TCP segment of a reassembled PDU]"
"113","0.515705646","127.0.0.1","127.0.0.1","TCP","66","14002  >  12002 [ACK] Seq=1 Ack=7217 Win=64384 Len=0 TSval=128090024 TSecr=128090024"
"114","0.515709884","127.0.0.1","127.0.0.1","TCP","66","14003  >  12003 [ACK] Seq=1 Ack=11313 Win=63360 Len=0 TSval=128090024 TSecr=128090024"
"115","0.515707796","127.0.0.1","127.0.0.1","TCP","66","14000  >  12000 [ACK] Seq=1 Ack=1072 Win=64512 Len=0 TSval=128090024 TSecr=128090024"
"116","0.515715337","127.0.0.1","127.0.0.1","TCP","66","14001  >  12001 [ACK] Seq=1 Ack=3121 Win=64384 Len=0 TSval=128090024 TSecr=128090024"
"117","0.515726512","127.0.0.1","127.0.0.1","TCP","1090","12003  >  14003 [PSH, ACK] Seq=11313 Ack=1 Win=65536 Len=1024 TSval=128090024 TSecr=128090024"
"118","0.515731209","127.0.0.1","127.0.0.1","TCP","66","14003  >  12003 [ACK] Seq=1 Ack=12337 Win=62848 Len=0 TSval=128090024 TSecr=128090024"
"119","0.515752837","127.0.0.1","127.0.0.1","TCP","1090","12001  >  14001 [PSH, ACK] Seq=3121 Ack=1 Win=65536 Len=1024 TSval=128090024 TSecr=128090024 [TCP segment of a reassembled PDU]"
"120","0.515756021","127.0.0.1","127.0.0.1","TCP","66","14001  >  12001 [ACK] Seq=1 Ack=4145 Win=64384 Len=0 TSval=128090024 TSecr=128090024"
"121","0.515782629","127.0.0.1","127.0.0.1","TCP","1090","12000  >  14000 [PSH, ACK] Seq=1072 Ack=1 Win=65536 Len=1024 TSval=128090024 TSecr=128090024"
"122","0.515786672","127.0.0.1","127.0.0.1","TCP","1090","12003  >  14003 [PSH, ACK] Seq=12337 Ack=1 Win=65536 Len=1024 TSval=128090024 TSecr=128090024"
"123","0.515788462","127.0.0.1","127.0.0.1","TCP","66","14000  >  12000 [ACK] Seq=1 Ack=2096 Win=64384 Len=0 TSval=128090024 TSecr=128090024"
"124","0.515791151","127.0.0.1","127.0.0.1","TCP","66","14003  >  12003 [ACK] Seq=1 Ack=13361 Win=62336 Len=0 TSval=128090024 TSecr=128090024"
"125","0.515795297","127.0.0.1","127.0.0.1","TCP","1090","12001  >  14001 [PSH, ACK] Seq=4145 Ack=1 Win=65536 Len=1024 TSval=128090024 TSecr=128090024 [TCP segment of a reassembled PDU]"
"126","0.515798251","127.0.0.1","127.0.0.1","TCP","66","14001  >  12001 [ACK] Seq=1 Ack=5169 Win=64384 Len=0 TSval=128090024 TSecr=128090024"
"127","0.515812740","127.0.0.1","127.0.0.1","TCP","1090","12002  >  14002 [PSH, ACK] Seq=7217 Ack=1 Win=65536 Len=1024 TSval=128090024 TSecr=128090024"
"128","0.515817063","127.0.0.1","127.0.0.1","TCP","66","14002  >  12002 [ACK] Seq=1 Ack=8241 Win=64384 Len=0 TSval=128090024 TSecr=128090024"
"129","0.515822629","127.0.0.1","127.0.0.1","TCP","1090","12003  >  14003 [PSH, ACK] Seq=13361 Ack=1 Win=65536 Len=1024 TSval=128090024 TSecr=128090024"
"130","0.515829359","127.0.0.1","127.0.0.1","TCP","66","14003  >  12003 [ACK] Seq=1 Ack=14385 Win=61824 Len=0 TSval=128090024 TSecr=128090024"
"131","0.515844667","127.0.0.1","127.0.0.1","TCP","1090","12000  >  14000 [PSH, ACK] Seq=2096 Ack=1 Win=65536 Len=1024 TSval=128090024 TSecr=128090024"
"132","0.515847957","127.0.0.1","127.0.0.1","TCP","66","14000  >  12000 [ACK] Seq=1 Ack=3120 Win=64384 Len=0 TSval=128090024 TSecr=128090024"
"133","0.515849473","127.0.0.1","127.0.0.1","TCP","1090","12003  >  14003 [PSH, ACK] Seq=14385 Ack=1 Win=65536 Len=1024 TSval=128090024 TSecr=128090024"
"134","0.515852960","127.0.0.1","127.0.0.1","TCP","66","14003  >  12003 [ACK] Seq=1 Ack=15409 Win=61312 Len=0 TSval=128090024 TSecr=128090024"
"135","0.515871901","127.0.0.1","127.0.0.1","TCP","1090","12001  >  14001 [PSH, ACK] Seq=5169 Ack=1 Win=65536 Len=1024 TSval=128090024 TSecr=128090024 [TCP segment of a reassembled PDU]"
"136","0.515877775","127.0.0.1","127.0.0.1","TCP","66","14001  >  12001 [ACK] Seq=1 Ack=6193 Win=63872 Len=0 TSval=128090024 TSecr=128090024"
"137","0.515882417","127.0.0.1","127.0.0.1","TCP","1090","12002  >  14002 [PSH, ACK] Seq=8241 Ack=1 Win=65536 Len=1024 TSval=128090024 TSecr=128090024"
"138","0.515886817","127.0.0.1","127.0.0.1","TCP","66","14002  >  12002 [ACK] Seq=1 Ack=9265 Win=64384 Len=0 TSval=128090024 TSecr=128090024"
"139","0.515892455","127.0.0.1","127.0.0.1","TCP","1090","12003  >  14003 [PSH, ACK] Seq=15409 Ack=1 Win=65536 Len=1024 TSval=128090024 TSecr=128090024"
"140","0.515896400","127.0.0.1","127.0.0.1","TCP","66","14003  >  12003 [ACK] Seq=1 Ack=16433 Win=60800 Len=0 TSval=128090024 TSecr=128090024"
"141","0.515907062","127.0.0.1","127.0.0.1","TCP","1090","12001  >  14001 [PSH, ACK] Seq=6193 Ack=1 Win=65536 Len=1024 TSval=128090024 TSecr=128090024 [TCP segment of a reassembled PDU]"
"142","0.515912396","127.0.0.1","127.0.0.1","TCP","66","14001  >  12001 [ACK] Seq=1 Ack=7217 Win=63360 Len=0 TSval=128090024 TSecr=128090024"
"143","0.515927723","127.0.0.1","127.0.0.1","TCP","1090","12003  >  14003 [PSH, ACK] Seq=16433 Ack=1 Win=65536 Len=1024 TSval=128090024 TSecr=128090024"
"144","0.515932459","127.0.0.1","127.0.0.1","TCP","1090","12002  >  14002 [PSH, ACK] Seq=9265 Ack=1 Win=65536 Len=1024 TSval=128090024 TSecr=128090024"
"145","0.515936249","127.0.0.1","127.0.0.1","TCP","66","14002  >  12002 [ACK] Seq=1 Ack=10289 Win=64384 Len=0 TSval=128090024 TSecr=128090024"
"146","0.515987666","127.0.0.1","127.0.0.1","TCP","1090","12001  >  14001 [PSH, ACK] Seq=7217 Ack=1 Win=65536 Len=1024 TSval=128090024 TSecr=128090024 [TCP segment of a reassembled PDU]"
"147","0.515993099","127.0.0.1","127.0.0.1","TCP","66","14001  >  12001 [ACK] Seq=1 Ack=8241 Win=64384 Len=0 TSval=128090024 TSecr=128090024"
"148","0.515998365","127.0.0.1","127.0.0.1","TCP","1090","12000  >  14000 [PSH, ACK] Seq=3120 Ack=1 Win=65536 Len=1024 TSval=128090024 TSecr=128090024"
"149","0.516002177","127.0.0.1","127.0.0.1","TCP","66","14000  >  12000 [ACK] Seq=1 Ack=4144 Win=64384 Len=0 TSval=128090024 TSecr=128090024"
"150","0.516013030","127.0.0.1","127.0.0.1","TCP","1090","12002  >  14002 [PSH, ACK] Seq=10289 Ack=1 Win=65536 Len=1024 TSval=128090024 TSecr=128090024"
"151","0.516017525","127.0.0.1","127.0.0.1","TCP","66","14002  >  12002 [ACK] Seq=1 Ack=11313 Win=63872 Len=0 TSval=128090024 TSecr=128090024"
"152","0.516032358","127.0.0.1","127.0.0.1","TCP","1090","12001  >  14001 [PSH, ACK] Seq=8241 Ack=1 Win=65536 Len=1024 TSval=128090024 TSecr=128090024 [TCP segment of a reassembled PDU]"
"153","0.516035223","127.0.0.1","127.0.0.1","TCP","66","14001  >  12001 [ACK] Seq=1 Ack=9265 Win=64384 Len=0 TSval=128090024 TSecr=128090024"
"154","0.516047114","127.0.0.1","127.0.0.1","TCP","1090","12001  >  14001 [PSH, ACK] Seq=9265 Ack=1 Win=65536 Len=1024 TSval=128090024 TSecr=128090024 [TCP segment of a reassembled PDU]"
"155","0.516049328","127.0.0.1","127.0.0.1","TCP","1090","12000  >  14000 [PSH, ACK] Seq=4144 Ack=1 Win=65536 Len=1024 TSval=128090024 TSecr=128090024"
"156","0.516050515","127.0.0.1","127.0.0.1","TCP","66","14001  >  12001 [ACK] Seq=1 Ack=10289 Win=64384 Len=0 TSval=128090024 TSecr=128090024"
"157","0.516053296","127.0.0.1","127.0.0.1","TCP","66","14000  >  12000 [ACK] Seq=1 Ack=5168 Win=64384 Len=0 TSval=128090024 TSecr=128090024"
"158","0.516063113","127.0.0.1","127.0.0.1","TCP","1090","12000  >  14000 [PSH, ACK] Seq=5168 Ack=1 Win=65536 Len=1024 TSval=128090024 TSecr=128090024"
"159","0.516062926","127.0.0.1","127.0.0.1","TCP","1090","12002  >  14002 [PSH, ACK] Seq=11313 Ack=1 Win=65536 Len=1024 TSval=128090024 TSecr=128090024"
"160","0.516069037","127.0.0.1","127.0.0.1","TCP","66","14000  >  12000 [ACK] Seq=1 Ack=6192 Win=63872 Len=0 TSval=128090024 TSecr=128090024"
"161","0.516068812","127.0.0.1","127.0.0.1","TCP","66","14002  >  12002 [ACK] Seq=1 Ack=12337 Win=63360 Len=0 TSval=128090024 TSecr=128090024"
"162","0.516078666","127.0.0.1","127.0.0.1","TCP","1090","12001  >  14001 [PSH, ACK] Seq=10289 Ack=1 Win=65536 Len=1024 TSval=128090024 TSecr=128090024 [TCP segment of a reassembled PDU]"
"163","0.516082755","127.0.0.1","127.0.0.1","TCP","66","14001  >  12001 [ACK] Seq=1 Ack=11313 Win=63872 Len=0 TSval=128090024 TSecr=128090024"
"164","0.516101946","127.0.0.1","127.0.0.1","TCP","1090","12000  >  14000 [PSH, ACK] Seq=6192 Ack=1 Win=65536 Len=1024 TSval=128090024 TSecr=128090024"
"165","0.516106551","127.0.0.1","127.0.0.1","TCP","66","14000  >  12000 [ACK] Seq=1 Ack=7216 Win=63360 Len=0 TSval=128090024 TSecr=128090024"
"166","0.516110230","127.0.0.1","127.0.0.1","TCP","1090","12002  >  14002 [PSH, ACK] Seq=12337 Ack=1 Win=65536 Len=1024 TSval=128090024 TSecr=128090024"
"167","0.516114812","127.0.0.1","127.0.0.1","TCP","66","14002  >  12002 [ACK] Seq=1 Ack=13361 Win=62848 Len=0 TSval=128090024 TSecr=128090024"
"168","0.516122973","127.0.0.1","127.0.0.1","TCP","1090","12001  >  14001 [PSH, ACK] Seq=11313 Ack=1 Win=65536 Len=1024 TSval=128090024 TSecr=128090024 [TCP segment of a reassembled PDU]"
"169","0.516127103","127.0.0.1","127.0.0.1","TCP","66","14001  >  12001 [ACK] Seq=1 Ack=12337 Win=63360 Len=0 TSval=128090024 TSecr=128090024"
"170","0.516132548","127.0.0.1","127.0.0.1","TCP","1090","12002  >  14002 [PSH, ACK] Seq=13361 Ack=1 Win=65536 Len=1024 TSval=128090024 TSecr=128090024"
"171","0.516135281","127.0.0.1","127.0.0.1","TCP","66","14002  >  12002 [ACK] Seq=1 Ack=14385 Win=64384 Len=0 TSval=128090024 TSecr=128090024"
"172","0.516143494","127.0.0.1","127.0.0.1","TCP","1090","12000  >  14000 [PSH, ACK] Seq=7216 Ack=1 Win=65536 Len=1024 TSval=128090024 TSecr=128090024"
"173","0.516147449","127.0.0.1","127.0.0.1","TCP","66","14000  >  12000 [ACK] Seq=1 Ack=8240 Win=62848 Len=0 TSval=128090024 TSecr=128090024"
"174","0.516154744","127.0.0.1","127.0.0.1","TCP","1090","12002  >  14002 [PSH, ACK] Seq=14385 Ack=1 Win=65536 Len=1024 TSval=128090024 TSecr=128090024"
"175","0.516158364","127.0.0.1","127.0.0.1","TCP","66","14002  >  12002 [ACK] Seq=1 Ack=15409 Win=64384 Len=0 TSval=128090024 TSecr=128090024"
"176","0.516198868","127.0.0.1","127.0.0.1","UMA","1090","[TCP segment of a reassembled PDU]"
"177","0.516201856","127.0.0.1","127.0.0.1","TCP","66","14001  >  12001 [ACK] Seq=1 Ack=13361 Win=62848 Len=0 TSval=128090024 TSecr=128090024"
"178","0.516217952","127.0.0.1","127.0.0.1","TCP","1090","12000  >  14000 [PSH, ACK] Seq=8240 Ack=1 Win=65536 Len=1024 TSval=128090024 TSecr=128090024"
"179","0.516222397","127.0.0.1","127.0.0.1","TCP","66","14000  >  12000 [ACK] Seq=1 Ack=9264 Win=62336 Len=0 TSval=128090024 TSecr=128090024"
"180","0.516225275","127.0.0.1","127.0.0.1","TCP","1090","12002  >  14002 [PSH, ACK] Seq=15409 Ack=1 Win=65536 Len=1024 TSval=128090024 TSecr=128090024"
"181","0.516230494","127.0.0.1","127.0.0.1","TCP","1090","12001  >  14001 [PSH, ACK] Seq=13361 Ack=1 Win=65536 Len=1024 TSval=128090024 TSecr=128090024 [TCP segment of a reassembled PDU]"
"182","0.516230016","127.0.0.1","127.0.0.1","TCP","66","14002  >  12002 [ACK] Seq=1 Ack=16433 Win=64384 Len=0 TSval=128090024 TSecr=128090024"
"183","0.516234257","127.0.0.1","127.0.0.1","TCP","66","14001  >  12001 [ACK] Seq=1 Ack=14385 Win=62336 Len=0 TSval=128090024 TSecr=128090024"
"184","0.516237286","127.0.0.1","127.0.0.1","TCP","1090","12000  >  14000 [PSH, ACK] Seq=9264 Ack=1 Win=65536 Len=1024 TSval=128090024 TSecr=128090024"
"185","0.516241796","127.0.0.1","127.0.0.1","TCP","66","14000  >  12000 [ACK] Seq=1 Ack=10288 Win=61824 Len=0 TSval=128090024 TSecr=128090024"
"186","0.516248182","127.0.0.1","127.0.0.1","TCP","1090","12002  >  14002 [PSH, ACK] Seq=16433 Ack=1 Win=65536 Len=1024 TSval=128090024 TSecr=128090024"
"187","0.516254645","127.0.0.1","127.0.0.1","TCP","1090","12000  >  14000 [PSH, ACK] Seq=10288 Ack=1 Win=65536 Len=1024 TSval=128090024 TSecr=128090024"
"188","0.516258681","127.0.0.1","127.0.0.1","TCP","66","14000  >  12000 [ACK] Seq=1 Ack=11312 Win=61312 Len=0 TSval=128090024 TSecr=128090024"
"189","0.516261224","127.0.0.1","127.0.0.1","TCP","1090","12001  >  14001 [PSH, ACK] Seq=14385 Ack=1 Win=65536 Len=1024 TSval=128090024 TSecr=128090024 [TCP segment of a reassembled PDU]"
"190","0.516266906","127.0.0.1","127.0.0.1","TCP","66","14001  >  12001 [ACK] Seq=1 Ack=15409 Win=61824 Len=0 TSval=128090024 TSecr=128090024"
"191","0.516277260","127.0.0.1","127.0.0.1","TCP","1090","12000  >  14000 [PSH, ACK] Seq=11312 Ack=1 Win=65536 Len=1024 TSval=128090024 TSecr=128090024"
"192","0.516281090","127.0.0.1","127.0.0.1","TCP","1090","12001  >  14001 [PSH, ACK] Seq=15409 Ack=1 Win=65536 Len=1024 TSval=128090024 TSecr=128090024 [TCP segment of a reassembled PDU]"
"193","0.516281459","127.0.0.1","127.0.0.1","TCP","66","14000  >  12000 [ACK] Seq=1 Ack=12336 Win=60800 Len=0 TSval=128090024 TSecr=128090024"
"194","0.516285968","127.0.0.1","127.0.0.1","TCP","66","14001  >  12001 [ACK] Seq=1 Ack=16433 Win=64384 Len=0 TSval=128090024 TSecr=128090024"
"195","0.516304285","127.0.0.1","127.0.0.1","TCP","1090","12000  >  14000 [PSH, ACK] Seq=12336 Ack=1 Win=65536 Len=1024 TSval=128090024 TSecr=128090024"
"196","0.516308104","127.0.0.1","127.0.0.1","TCP","66","14000  >  12000 [ACK] Seq=1 Ack=13360 Win=60288 Len=0 TSval=128090024 TSecr=128090024"
"197","0.516333939","127.0.0.1","127.0.0.1","TCP","1090","12000  >  14000 [PSH, ACK] Seq=13360 Ack=1 Win=65536 Len=1024 TSval=128090024 TSecr=128090024"
"198","0.516338947","127.0.0.1","127.0.0.1","TCP","66","14000  >  12000 [ACK] Seq=1 Ack=14384 Win=59776 Len=0 TSval=128090024 TSecr=128090024"
"199","0.516343083","127.0.0.1","127.0.0.1","TCP","1090","12001  >  14001 [PSH, ACK] Seq=16433 Ack=1 Win=65536 Len=1024 TSval=128090024 TSecr=128090024 [TCP segment of a reassembled PDU]"
"200","0.516352811","127.0.0.1","127.0.0.1","TCP","1090","12000  >  14000 [PSH, ACK] Seq=14384 Ack=1 Win=65536 Len=1024 TSval=128090024 TSecr=128090024"
"201","0.516356697","127.0.0.1","127.0.0.1","TCP","66","14000  >  12000 [ACK] Seq=1 Ack=15408 Win=59264 Len=0 TSval=128090024 TSecr=128090024"
"202","0.516373744","127.0.0.1","127.0.0.1","TCP","1090","12000  >  14000 [PSH, ACK] Seq=15408 Ack=1 Win=65536 Len=1024 TSval=128090024 TSecr=128090024"
"203","0.516378208","127.0.0.1","127.0.0.1","TCP","66","14000  >  12000 [ACK] Seq=1 Ack=16432 Win=58752 Len=0 TSval=128090024 TSecr=128090024"
"204","0.516415864","127.0.0.1","127.0.0.1","TCP","1090","12000  >  14000 [PSH, ACK] Seq=16432 Ack=1 Win=65536 Len=1024 TSval=128090024 TSecr=128090024"
"205","0.558315318","127.0.0.1","127.0.0.1","TCP","66","14003  >  12003 [ACK] Seq=1 Ack=17457 Win=65536 Len=0 TSval=128090066 TSecr=128090024"
"206","0.558335771","127.0.0.1","127.0.0.1","TCP","6210","12003  >  14003 [PSH, ACK] Seq=17457 Ack=1 Win=65536 Len=6144 TSval=128090066 TSecr=128090066"
"207","0.562368469","127.0.0.1","127.0.0.1","TCP","66","14000  >  12000 [ACK] Seq=1 Ack=17456 Win=65536 Len=0 TSval=128090070 TSecr=128090024"
"208","0.562370114","127.0.0.1","127.0.0.1","TCP","66","14002  >  12002 [ACK] Seq=1 Ack=17457 Win=65536 Len=0 TSval=128090070 TSecr=128090024"
"209","0.562370104","127.0.0.1","127.0.0.1","TCP","66","14001  >  12001 [ACK] Seq=1 Ack=17457 Win=65536 Len=0 TSval=128090070 TSecr=128090024"
"210","0.562379216","127.0.0.1","127.0.0.1","TCP","6210","12000  >  14000 [PSH, ACK] Seq=17456 Ack=1 Win=65536 Len=6144 TSval=128090070 TSecr=128090070"
"211","0.562387157","127.0.0.1","127.0.0.1","TCP","6210","12001  >  14001 [PSH, ACK] Seq=17457 Ack=1 Win=65536 Len=6144 TSval=128090070 TSecr=128090070 [TCP segment of a reassembled PDU]"
"212","0.562387058","127.0.0.1","127.0.0.1","TCP","6210","12002  >  14002 [PSH, ACK] Seq=17457 Ack=1 Win=65536 Len=6144 TSval=128090070 TSecr=128090070"
"213","0.602424169","127.0.0.1","127.0.0.1","TCP","66","14003  >  12003 [ACK] Seq=1 Ack=23601 Win=65536 Len=0 TSval=128090110 TSecr=128090066"
"214","0.606314488","127.0.0.1","127.0.0.1","TCP","66","14001  >  12001 [ACK] Seq=1 Ack=23601 Win=65536 Len=0 TSval=128090114 TSecr=128090070"
"215","0.610362387","127.0.0.1","127.0.0.1","TCP","66","14000  >  12000 [ACK] Seq=1 Ack=23600 Win=65536 Len=0 TSval=128090118 TSecr=128090070"
"216","0.610548193","127.0.0.1","127.0.0.1","TCP","66","14002  >  12002 [ACK] Seq=1 Ack=23601 Win=65536 Len=0 TSval=128090118 TSecr=128090070"
"217","1.564142634","127.0.0.1","127.0.0.1","UDP","44","15000  >  13000 Len=2"
"218","1.564215029","127.0.0.1","127.0.0.1","UDP","44","13000  >  15001 Len=2"
"219","1.564561801","127.0.0.1","127.0.0.1","UDP","44","15001  >  13001 Len=2"
"220","1.564634670","127.0.0.1","127.0.0.1","UDP","44","13001  >  15000 Len=2"
"221","1.564781489","127.0.0.1","127.0.0.1","UDP","46","15000  >  13001 Len=4"
"222","1.564810050","127.0.0.1","127.0.0.1","UDP","44","13001  >  15002 Len=2"
"223","1.564935787","127.0.0.1","127.0.0.1","UDP","44","15002  >  13002 Len=2"
"224","1.564957212","127.0.0.1","127.0.0.1","UDP","46","15001  >  13000 Len=4"
"225","1.564965039","127.0.0.1","127.0.0.1","UDP","44","13002  >  15000 Len=2"
"226","1.564983055","127.0.0.1","127.0.0.1","UDP","44","13000  >  15002 Len=2"
"227","1.565161167","127.0.0.1","127.0.0.1","UDP","46","15000  >  13002 Len=4"
"228","1.565218311","127.0.0.1","127.0.0.1","TCP","1090","14000  >  12000 [PSH, ACK] Seq=1 Ack=23600 Win=65536 Len=1024 TSval=128091073 TSecr=128090070"
"229","1.565226169","127.0.0.1","127.0.0.1","TCP","66","12000  >  14000 [ACK] Seq=23600 Ack=1025 Win=64512 Len=0 TSval=128091073 TSecr=128091073"
"230","1.565244568","127.0.0.1","127.0.0.1","TCP","1090","12002  >  14002 [PSH, ACK] Seq=23601 Ack=1 Win=65536 Len=1024 TSval=128091073 TSecr=128090118"
"231","1.565248457","127.0.0.1","127.0.0.1","TCP","66","14002  >  12002 [ACK] Seq=1 Ack=24625 Win=64512 Len=0 TSval=128091073 TSecr=128091073"
"232","1.565285655","127.0.0.1","127.0.0.1","UDP","46","15002  >  13001 Len=4"
"233","1.565304956","127.0.0.1","127.0.0.1","UDP","46","15002  >  13000 Len=4"
"234","1.565304844","127.0.0.1","127.0.0.1","UDP","44","13001  >  15003 Len=2"
"235","1.565321117","127.0.0.1","127.0.0.1","UDP","44","13000  >  15003 Len=2"
"236","1.565379853","127.0.0.1","127.0.0.1","UDP","44","15003  >  13003 Len=2"
"237","1.565390108","127.0.0.1","127.0.0.1","UDP","44","15002  >  13002 Len=2"
"238","1.565397805","127.0.0.1","127.0.0.1","UDP","44","13003  >  15000 Len=2"
"239","1.565411624","127.0.0.1","127.0.0.1","UDP","44","13002  >  15000 Len=2"
"240","1.565436989","127.0.0.1","127.0.0.1","UDP","46","15000  >  13003 Len=4"
"241","1.565447871","127.0.0.1","127.0.0.1","UDP","44","13003  >  15001 Len=2"
"242","1.565510266","127.0.0.1","127.0.0.1","UDP","46","15000  >  13002 Len=4"
"243","1.565520279","127.0.0.1","127.0.0.1","UDP","46","15001  >  13003 Len=4"
"244","1.565565803","127.0.0.1","127.0.0.1","UDP","46","15003  >  13001 Len=4"
"245","1.565577443","127.0.0.1","127.0.0.1","TCP","1090","14001  >  12001 [PSH, ACK] Seq=1 Ack=23601 Win=65536 Len=1024 TSval=128091073 TSecr=128090070 [TCP segment of a reassembled PDU]"
"246","1.565578346","127.0.0.1","127.0.0.1","UDP","44","13001  >  15004 Len=2"
"247","1.565584056","127.0.0.1","127.0.0.1","TCP","66","12001  >  14001 [ACK] Seq=23601 Ack=1025 Win=64512 Len=0 TSval=128091073 TSecr=128091073"
"248","1.565594105","127.0.0.1","127.0.0.1","UDP","46","15003  >  13000 Len=4"
"249","1.565597202","127.0.0.1","127.0.0.1","TCP","1090","12003  >  14003 [PSH, ACK] Seq=23601 Ack=1 Win=65536 Len=1024 TSval=128091073 TSecr=128090110"
"250","1.565600230","127.0.0.1","127.0.0.1","TCP","66","14003  >  12003 [ACK] Seq=1 Ack=24625 Win=64512 Len=0 TSval=128091073 TSecr=128091073"
"251","1.565603706","127.0.0.1","127.0.0.1","TCP","1090","14000  >  12000 [PSH, ACK] Seq=1025 Ack=23600 Win=65536 Len=1024 TSval=128091073 TSecr=128091073"
"252","1.565610528","127.0.0.1","127.0.0.1","TCP","1090","14003  >  12003 [PSH, ACK] Seq=1 Ack=24625 Win=64512 Len=1024 TSval=128091073 TSecr=128091073"
"253","1.565607678","127.0.0.1","127.0.0.1","TCP","66","12000  >  14000 [ACK] Seq=23600 Ack=2049 Win=64384 Len=0 TSval=128091073 TSecr=128091073"
"254","1.565613884","127.0.0.1","127.0.0.1","TCP","66","12003  >  14003 [ACK] Seq=24625 Ack=1025 Win=64512 Len=0 TSval=128091073 TSecr=128091073"
"255","1.565625186","127.0.0.1","127.0.0.1","TCP","1090","12000  >  14000 [PSH, ACK] Seq=23600 Ack=2049 Win=64384 Len=1024 TSval=128091073 TSecr=128091073"
"256","1.565627283","127.0.0.1","127.0.0.1","TCP","66","14000  >  12000 [ACK] Seq=2049 Ack=24624 Win=64512 Len=0 TSval=128091073 TSecr=128091073"
"257","1.565642821","127.0.0.1","127.0.0.1","TCP","1090","12002  >  14002 [PSH, ACK] Seq=24625 Ack=1 Win=65536 Len=1024 TSval=128091073 TSecr=128091073"
"258","1.565644577","127.0.0.1","127.0.0.1","TCP","66","14002  >  12002 [ACK] Seq=1 Ack=25649 Win=64384 Len=0 TSval=128091073 TSecr=128091073"
"259","1.565670085","127.0.0.1","127.0.0.1","UDP","44","15002  >  13002 Len=2"
"260","1.565689135","127.0.0.1","127.0.0.1","UDP","44","13002  >  15000 Len=2"
"261","1.565728904","127.0.0.1","127.0.0.1","UDP","43","15004  >  13004 Len=1"
"262","1.565738919","127.0.0.1","127.0.0.1","UDP","44","15003  >  13003 Len=2"
"263","1.565748887","127.0.0.1","127.0.0.1","UDP","43","13004  >  15000 Len=1"
"264","1.565753784","127.0.0.1","127.0.0.1","UDP","44","15000  >  13000 Len=2"
"265","1.565757514","127.0.0.1","127.0.0.1","UDP","44","13003  >  15000 Len=2"
"266","1.565768107","127.0.0.1","127.0.0.1","UDP","46","15000  >  13002 Len=4"
"267","1.565773064","127.0.0.1","127.0.0.1","UDP","44","13000  >  15001 Len=2"
"268","1.565782178","127.0.0.1","127.0.0.1","UDP","44","13002  >  15001 Len=2"
"269","1.565788266","127.0.0.1","127.0.0.1","UDP","46","15000  >  13004 Len=4"
"270","1.565861120","127.0.0.1","127.0.0.1","UDP","46","15001  >  13000 Len=4"
"271","1.565872750","127.0.0.1","127.0.0.1","UDP","44","13000  >  15002 Len=2"
"272","1.565888470","127.0.0.1","127.0.0.1","TCP","1090","14000  >  12000 [PSH, ACK] Seq=2049 Ack=24624 Win=65536 Len=1024 TSval=128091074 TSecr=128091073"
"273","1.565892286","127.0.0.1","127.0.0.1","TCP","66","12000  >  14000 [ACK] Seq=24624 Ack=3073 Win=64384 Len=0 TSval=128091074 TSecr=128091074"
"274","1.565900277","127.0.0.1","127.0.0.1","UDP","46","15002  >  13000 Len=4"
"275","1.565902571","127.0.0.1","127.0.0.1","TCP","1090","12004  >  14004 [PSH, ACK] Seq=23738 Ack=1 Win=65536 Len=1024 TSval=128091074 TSecr=128090019"
"276","1.565905092","127.0.0.1","127.0.0.1","TCP","66","14004  >  12004 [ACK] Seq=1 Ack=24762 Win=64384 Len=0 TSval=128091074 TSecr=128091074"
"277","1.565912693","127.0.0.1","127.0.0.1","UDP","46","15001  >  13002 Len=4"
"278","1.565916513","127.0.0.1","127.0.0.1","UDP","44","13000  >  15003 Len=2"
"279","1.565952301","127.0.0.1","127.0.0.1","UDP","44","13002  >  15003 Len=2"
"280","1.565956687","127.0.0.1","127.0.0.1","UDP","46","15004  >  13001 Len=4"
"281","1.565969946","127.0.0.1","127.0.0.1","UDP","46","15000  >  13003 Len=4"
"282","1.565979924","127.0.0.1","127.0.0.1","UDP","44","15004  >  13004 Len=2"
"283","1.565980245","127.0.0.1","127.0.0.1","UDP","44","13003  >  15001 Len=2"
"284","1.565989659","127.0.0.1","127.0.0.1","UDP","46","15003  >  13000 Len=4"
"285","1.565994842","127.0.0.1","127.0.0.1","UDP","44","13004  >  15000 Len=2"
